Contact_name,ph_no,Address,Latitude,Longitude,Zone,Speciality,Locality,Contact_id,Segment,Contact_email
Krishna Shalby Hospital,+91 99044 33369,"Ghuma, Via Bopal, Ahmedabad",23.02,72.44,West,Multi-Specialty,Ghuma,CONT_AHD_REAL_257,Growth Catalyst,
Apollo Hospitals City Centre,+91 79 2665 1234,"Nr Parimal Crossing, Paldi, Ahmedabad",23.01,72.56,West,Multi-Specialty,Paldi,CONT_AHD_REAL_258,Growth Catalyst,
Bodyline Hospitals,+91 79 2662 2222,"Vikas Gruh Road, Paldi, Ahmedabad",23.012,72.558,West,Multi-Specialty,Paldi,CONT_AHD_REAL_259,Growth Catalyst,
Jivraj Mehta Hospital,+91 79 2663 6363,"Jivraj Park, Lavanya, Ahmedabad",23.005,72.55,West,Multi-Specialty,Vasna,CONT_AHD_REAL_260,Growth Catalyst,
Sanjivani Super Speciality,+91 79 2676 1111,"Nr Sunrise Park, Vastrapur, Ahmedabad",23.04,72.53,West,Multi-Specialty,Vastrapur,CONT_AHD_REAL_261,Growth Catalyst,
Sterling Hospital,+91 79 4001 1111,"Gurukul Road, Memnagar, Ahmedabad",23.05,72.52,West,Multi-Specialty,Memnagar,CONT_AHD_REAL_262,Growth Catalyst,
Zydus Hospital,+91 79 6619 0000,"Thaltej Hebatpur Road, Ahmedabad",23.06,72.51,West,Multi-Specialty,Thaltej,CONT_AHD_REAL_263,Growth Catalyst,
KD Hospital,+91 79 6677 0000,"Vaishno Devi Circle, SG Highway, Ahmedabad",23.1,72.53,West,Multi-Specialty,SG Highway,CONT_AHD_REAL_264,Growth Catalyst,
Life Care Hospital,+91 2717 232 323,"Nr Kabir Enclave, Bopal, Ahmedabad",23.03,72.46,West,Multi-Specialty,Bopal,CONT_AHD_REAL_265,Growth Catalyst,
Mamta Hospital,+91 2717 233 333,"Aarohi Arcade, Bopal, Ahmedabad",23.032,72.462,West,General,Bopal,CONT_AHD_REAL_266,Growth Catalyst,
Adwait Multispeciality Hospital,+91 81402 34111,"Bhavya Complex, Bopal, Ahmedabad",23.035,72.465,West,Multi-Specialty,Bopal,CONT_AHD_REAL_267,Growth Catalyst,
Saraswati Hospital,+91 2717 234 444,"Ambli Bopal Cross Road, Ahmedabad",23.028,72.458,West,Multi-Specialty,Bopal,CONT_AHD_REAL_268,Growth Catalyst,
Epic Hospital,+91 79 6815 5000,"Science City Road, Sola, Ahmedabad",23.075,72.525,West,Multi-Specialty,Sola,CONT_AHD_REAL_269,Growth Catalyst,
Civil Hospital Sola,+91 79 2766 1111,"Sola, SG Highway, Ahmedabad",23.08,72.52,West,Government,Sola,CONT_AHD_REAL_270,Growth Catalyst,
SVP Hospital,+91 79 2657 7656,"Ellisbridge, Ahmedabad",23.025,72.57,West,Government,Ellisbridge,CONT_AHD_REAL_271,Growth Catalyst,
